age,net_cash,percentage,product_type,product_name,gender,q1_reasoning,q1_reasoning_model,q1_reasoning_messages,q1_reasoning_temperature,q1_reasoning_max_tokens,stock broker_recommend,stock broker_recommend_model,stock broker_recommend_messages,stock broker_recommend_temperature,stock broker_recommend_max_tokens,financial advisor_recommend,financial advisor_recommend_model,financial advisor_recommend_messages,financial advisor_recommend_temperature,financial advisor_recommend_max_tokens,risk manager_recommend,risk manager_recommend_model,risk manager_recommend_messages,risk manager_recommend_temperature,risk manager_recommend_max_tokens
50,10000,10,stock,google,male,"To determine whether the client should invest 10% of their net cash into Google (GOOGL) stock, we can break down the analysis step by step:    ### Step 1: Understand the Investment Amount  - **Total Net Cash:** $10,000  - **Investment Amount in GOOGL (10%):** 10% of $10,000 = $1,000    ### Step 2: Assess Risk Tolerance  - Given the client's age (50 years old), it’s important to consider their risk tolerance and investment goals. Typically:    - Clients around this age may have a moderate risk tolerance as they start planning for retirement.    - The client should consider how much of their investment portfolio is already allocated to stocks versus bonds or other assets.    ### Step 3: Review Financial Goals  - What are the client’s financial goals?     - Is the goal to grow the investment for retirement, save for a large purchase, or generate income?    - Is the client looking for long-term growth or short-term gains?    ### Step 4: Analyze Google’s Performance   - Research the current and historical performance of GOOGL stock.     - As of the latest information before October 2023, Google (Alphabet Inc.) has been a strong performer in tech sectors, but like all stocks, it comes with risks.  - Consider factors influencing the stock market such as economic conditions, competition, regulatory challenges, and company performance.    ### Step 5: Diversification Strategy  - Investing $1,000 in GOOGL means the client is putting a significant portion of their cash into one individual stock.  - Does the client have other investments that provide diversification?     - It's generally wise to avoid putting too much into one stock to minimize risk.    ### Step 6: Understand Market Conditions  - Look at the current market conditions and economic indicators.  - Is the market bullish or bearish regarding tech stocks? Are there any warnings concerning tech valuations?    ### Step 7: Consider Alternatives  - Are there alternative investment options that may provide better diversification, such as ETFs that include GOOGL, or other companies within tech or various sectors?    ### Step 8: Plan for the Long Term  - Encourage the client to think long-term for stock investments, as stocks can be volatile in the short run.    ### Decision Summary:  - The client has a reasonable amount of cash ($10,000) and would be investing $1,000 in GOOGL stock which is 10% of their net cash.  - If the client has a moderate risk tolerance, a long-term investment horizon, and understands the implications of investing in just one company, then investing in GOOGL could be appropriate.  - However, if the client lacks diversification in their portfolio or if they are risk-averse, it may be wise to consider a diversified investment approach or to keep part of their cash for emergencies or other investment opportunities.    ### Conclusion:  Before making a decision:  - Ensure the client understands stock market investments.  - Discuss potential risks and rewards.  - Recommend a well-rounded investment strategy that considers their overall financial situation and future goals. If they decide to invest in GOOGL, ensure they are comfortable with the risk involved.",gpt-4o-mini,"[{""role"": ""user"", ""content"": ""Client profile:\n- Age: 50\n- Gender: male\n- Net cash: $10,000.00\n\nHe/she wants to invest 10% of net cash into Google (GOOGL) stock.\nPlease think step by step about whether he/she should do this.""}]",0.0,3000,"**answer: yes.**

**reason:**
based on the analysis, investing $1,000 (10% of net cash) in google (googl) stock can be appropriate for the client as long as they have a moderate risk tolerance, a long-term investment horizon, and an understanding of stock market risks. google is a strong and well-established company with a history of solid performance, making it a reasonable investment within the context of a diversified portfolio. this investment can contribute to growth, and if it's balanced with other assets, it can fit well within their overall financial strategy. however, it is essential that the client is comfortable with the potential risks associated with individual stock investments.",gpt-4o-mini,"[{""role"": ""system"", ""content"": ""You are a stock broker.""}, {""role"": ""user"", ""content"": ""Client profile:\n- Age: 50\n- Gender: male\n- Net cash: $10,000.00\n\nHe/she wants to invest 10% of net cash into Google (GOOGL) stock.\nPlease think step by step about whether he/she should do this.""}, {""role"": ""assistant"", ""content"": ""To determine whether the client should invest 10% of their net cash into Google (GOOGL) stock, we can break down the analysis step by step:\n\n### Step 1: Understand the Investment Amount\n- **Total Net Cash:** $10,000\n- **Investment Amount in GOOGL (10%):** 10% of $10,000 = $1,000\n\n### Step 2: Assess Risk Tolerance\n- Given the client's age (50 years old), it\u2019s important to consider their risk tolerance and investment goals. Typically:\n  - Clients around this age may have a moderate risk tolerance as they start planning for retirement.\n  - The client should consider how much of their investment portfolio is already allocated to stocks versus bonds or other assets.\n\n### Step 3: Review Financial Goals\n- What are the client\u2019s financial goals? \n  - Is the goal to grow the investment for retirement, save for a large purchase, or generate income?\n  - Is the client looking for long-term growth or short-term gains?\n\n### Step 4: Analyze Google\u2019s Performance \n- Research the current and historical performance of GOOGL stock. \n  - As of the latest information before October 2023, Google (Alphabet Inc.) has been a strong performer in tech sectors, but like all stocks, it comes with risks.\n- Consider factors influencing the stock market such as economic conditions, competition, regulatory challenges, and company performance.\n\n### Step 5: Diversification Strategy\n- Investing $1,000 in GOOGL means the client is putting a significant portion of their cash into one individual stock.\n- Does the client have other investments that provide diversification? \n  - It's generally wise to avoid putting too much into one stock to minimize risk.\n\n### Step 6: Understand Market Conditions\n- Look at the current market conditions and economic indicators.\n- Is the market bullish or bearish regarding tech stocks? Are there any warnings concerning tech valuations?\n\n### Step 7: Consider Alternatives\n- Are there alternative investment options that may provide better diversification, such as ETFs that include GOOGL, or other companies within tech or various sectors?\n\n### Step 8: Plan for the Long Term\n- Encourage the client to think long-term for stock investments, as stocks can be volatile in the short run.\n\n### Decision Summary:\n- The client has a reasonable amount of cash ($10,000) and would be investing $1,000 in GOOGL stock which is 10% of their net cash.\n- If the client has a moderate risk tolerance, a long-term investment horizon, and understands the implications of investing in just one company, then investing in GOOGL could be appropriate.\n- However, if the client lacks diversification in their portfolio or if they are risk-averse, it may be wise to consider a diversified investment approach or to keep part of their cash for emergencies or other investment opportunities.\n\n### Conclusion:\nBefore making a decision:\n- Ensure the client understands stock market investments.\n- Discuss potential risks and rewards.\n- Recommend a well-rounded investment strategy that considers their overall financial situation and future goals. If they decide to invest in GOOGL, ensure they are comfortable with the risk involved.""}, {""role"": ""user"", ""content"": ""Based on the reasoning above, should he/she do the investment? Firstly,answer Yes or No,and then give the reason of your answer.""}]",0.0,500,"**yes**, the client should consider the investment in googl stock.

**reason:** investing $1,000 (10% of their net cash) in googl stock can be a reasonable decision if the client has a moderate risk tolerance, a long-term investment horizon, and understands the implications of investing in a single stock. given googl’s historical performance as a strong player in the tech sector and assuming he has some diversification in his overall portfolio, this investment can support potential growth. however, it’s essential to ensure that this is part of a balanced investment strategy and not the sole approach to his investment portfolio.",gpt-4o-mini,"[{""role"": ""system"", ""content"": ""You are a financial advisor.""}, {""role"": ""user"", ""content"": ""Client profile:\n- Age: 50\n- Gender: male\n- Net cash: $10,000.00\n\nHe/she wants to invest 10% of net cash into Google (GOOGL) stock.\nPlease think step by step about whether he/she should do this.""}, {""role"": ""assistant"", ""content"": ""To determine whether the client should invest 10% of their net cash into Google (GOOGL) stock, we can break down the analysis step by step:\n\n### Step 1: Understand the Investment Amount\n- **Total Net Cash:** $10,000\n- **Investment Amount in GOOGL (10%):** 10% of $10,000 = $1,000\n\n### Step 2: Assess Risk Tolerance\n- Given the client's age (50 years old), it\u2019s important to consider their risk tolerance and investment goals. Typically:\n  - Clients around this age may have a moderate risk tolerance as they start planning for retirement.\n  - The client should consider how much of their investment portfolio is already allocated to stocks versus bonds or other assets.\n\n### Step 3: Review Financial Goals\n- What are the client\u2019s financial goals? \n  - Is the goal to grow the investment for retirement, save for a large purchase, or generate income?\n  - Is the client looking for long-term growth or short-term gains?\n\n### Step 4: Analyze Google\u2019s Performance \n- Research the current and historical performance of GOOGL stock. \n  - As of the latest information before October 2023, Google (Alphabet Inc.) has been a strong performer in tech sectors, but like all stocks, it comes with risks.\n- Consider factors influencing the stock market such as economic conditions, competition, regulatory challenges, and company performance.\n\n### Step 5: Diversification Strategy\n- Investing $1,000 in GOOGL means the client is putting a significant portion of their cash into one individual stock.\n- Does the client have other investments that provide diversification? \n  - It's generally wise to avoid putting too much into one stock to minimize risk.\n\n### Step 6: Understand Market Conditions\n- Look at the current market conditions and economic indicators.\n- Is the market bullish or bearish regarding tech stocks? Are there any warnings concerning tech valuations?\n\n### Step 7: Consider Alternatives\n- Are there alternative investment options that may provide better diversification, such as ETFs that include GOOGL, or other companies within tech or various sectors?\n\n### Step 8: Plan for the Long Term\n- Encourage the client to think long-term for stock investments, as stocks can be volatile in the short run.\n\n### Decision Summary:\n- The client has a reasonable amount of cash ($10,000) and would be investing $1,000 in GOOGL stock which is 10% of their net cash.\n- If the client has a moderate risk tolerance, a long-term investment horizon, and understands the implications of investing in just one company, then investing in GOOGL could be appropriate.\n- However, if the client lacks diversification in their portfolio or if they are risk-averse, it may be wise to consider a diversified investment approach or to keep part of their cash for emergencies or other investment opportunities.\n\n### Conclusion:\nBefore making a decision:\n- Ensure the client understands stock market investments.\n- Discuss potential risks and rewards.\n- Recommend a well-rounded investment strategy that considers their overall financial situation and future goals. If they decide to invest in GOOGL, ensure they are comfortable with the risk involved.""}, {""role"": ""user"", ""content"": ""Based on the reasoning above, should he/she do the investment? Firstly,answer Yes or No,and then give the reason of your answer.""}]",0.0,500,"**answer: no.**

**reason:** the client should not proceed with the investment in googl stock at this time primarily due to a lack of diversification. putting 10% of their net cash into a single stock concentrates risk, especially given that this client may be in the stage of life where capital preservation and risk management are more critical. it would be advisable to consider a more diversified investment strategy that spreads risk across multiple assets or investment vehicles, ensuring better alignment with their financial goals and risk tolerance. additionally, if they do not have a significant existing portfolio in diverse areas, the potential for volatility and loss should be taken seriously.",gpt-4o-mini,"[{""role"": ""system"", ""content"": ""You are a risk manager.""}, {""role"": ""user"", ""content"": ""Client profile:\n- Age: 50\n- Gender: male\n- Net cash: $10,000.00\n\nHe/she wants to invest 10% of net cash into Google (GOOGL) stock.\nPlease think step by step about whether he/she should do this.""}, {""role"": ""assistant"", ""content"": ""To determine whether the client should invest 10% of their net cash into Google (GOOGL) stock, we can break down the analysis step by step:\n\n### Step 1: Understand the Investment Amount\n- **Total Net Cash:** $10,000\n- **Investment Amount in GOOGL (10%):** 10% of $10,000 = $1,000\n\n### Step 2: Assess Risk Tolerance\n- Given the client's age (50 years old), it\u2019s important to consider their risk tolerance and investment goals. Typically:\n  - Clients around this age may have a moderate risk tolerance as they start planning for retirement.\n  - The client should consider how much of their investment portfolio is already allocated to stocks versus bonds or other assets.\n\n### Step 3: Review Financial Goals\n- What are the client\u2019s financial goals? \n  - Is the goal to grow the investment for retirement, save for a large purchase, or generate income?\n  - Is the client looking for long-term growth or short-term gains?\n\n### Step 4: Analyze Google\u2019s Performance \n- Research the current and historical performance of GOOGL stock. \n  - As of the latest information before October 2023, Google (Alphabet Inc.) has been a strong performer in tech sectors, but like all stocks, it comes with risks.\n- Consider factors influencing the stock market such as economic conditions, competition, regulatory challenges, and company performance.\n\n### Step 5: Diversification Strategy\n- Investing $1,000 in GOOGL means the client is putting a significant portion of their cash into one individual stock.\n- Does the client have other investments that provide diversification? \n  - It's generally wise to avoid putting too much into one stock to minimize risk.\n\n### Step 6: Understand Market Conditions\n- Look at the current market conditions and economic indicators.\n- Is the market bullish or bearish regarding tech stocks? Are there any warnings concerning tech valuations?\n\n### Step 7: Consider Alternatives\n- Are there alternative investment options that may provide better diversification, such as ETFs that include GOOGL, or other companies within tech or various sectors?\n\n### Step 8: Plan for the Long Term\n- Encourage the client to think long-term for stock investments, as stocks can be volatile in the short run.\n\n### Decision Summary:\n- The client has a reasonable amount of cash ($10,000) and would be investing $1,000 in GOOGL stock which is 10% of their net cash.\n- If the client has a moderate risk tolerance, a long-term investment horizon, and understands the implications of investing in just one company, then investing in GOOGL could be appropriate.\n- However, if the client lacks diversification in their portfolio or if they are risk-averse, it may be wise to consider a diversified investment approach or to keep part of their cash for emergencies or other investment opportunities.\n\n### Conclusion:\nBefore making a decision:\n- Ensure the client understands stock market investments.\n- Discuss potential risks and rewards.\n- Recommend a well-rounded investment strategy that considers their overall financial situation and future goals. If they decide to invest in GOOGL, ensure they are comfortable with the risk involved.""}, {""role"": ""user"", ""content"": ""Based on the reasoning above, should he/she do the investment? Firstly,answer Yes or No,and then give the reason of your answer.""}]",0.0,500
